{
  "siteName": "tobrojekt.dev",
  "tagline": "Projects hub and portfolio",
  "description": "A clear, extensible home for Tobias's projects, built to grow over time.",
  "owner": {
    "name": "Tobias Wulff",
    "url": "https://tobrojekt.dev",
    "social": [{ "platform": "GitHub", "url": "https://github.com/tobiasalexanderwulff" }]
  },
  "primaryNavigation": [
    { "label": "Home", "href": "/" },
    { "label": "Projects", "href": "/projects" },
    { "label": "Blogs", "href": "/blogs" }
  ],
  "socialLinks": [{ "platform": "GitHub", "url": "https://github.com/tobiasalexanderwulff" }]
}
